file_name,text,url
report-fraud-on-business-account.txt,Report fraud on your business accountsCall us immediately if you think any of your Lloyds Business Bank accounts have been:accessed by a third party ortargeted for fraud.Please get in touch even if you haven’t suffered any loss from the attempted fraud.information-iconThis page is for business customersFind out how to report fraud if you’re a personal customer.Report Fraudheadset-iconBy PhoneCall us anytime on 0800 500 3920.You’ll need to tell us the reason for your call so we can direct you to our fraud team.Was this helpful?YesNoNohttps://www.lloydsbank.com/business/help-and-support/security-and-fraud/report-fraud-on-business-account.htmlReport fraud on your business accountsCall us immediately if you think any of your Lloyds Business Bank accounts have been:accessed by a third party ortargeted for fraud.Please get in touch even if you haven’t suffered any loss from the attempted fraud.information-iconThis page is for business customersFind out how to report fraud if you’re a personal customer.Report Fraudheadset-iconBy PhoneCall us anytime on 0800 500 3920.You’ll need to tell us the reason for your call so we can direct you to our fraud team.Was this helpful?YesNoNo,https://www.lloydsbank.com/business/help-and-support/security-and-fraud/report-fraud-on-business-account.html?WT.ac=lloyds-bb-help_support-category-repfraud-text-report_suspected_fraud
setting-up-a-standing-order.txt,"Set up a standing orderFind out how to set a standing order from your business accounts.Standing orders are a way of making fixed payments to a person or business at regular intervals, you control the amount, as well as when and how often it’s paid.I’m registered for Online for BusinessLog onto Online for Business.Select Payments and transfers next to the account the standing order will be paid from.Choose who to pay, then enter the amount and reference.Tick the ‘Repeat Payment (make this a standing order)’ box.You’ll now see some additional fields. Select when payment should start, how often it should be made and how long it should continue.You’ll be able to view, change or delete your standing orders at any time in Online for Business.I’m not registered for Online for BusinessTo get you to the right form we just need a bit of information from you.Is your turnover over £25 million?                            No                                                    Yes                        Based on your answers, here’s how to set up a standing order:Complete the form belowYou can return the completed form to us by posting it to:Lloyds Bank, Box 1, BX1 1LTSet up a standing order form (PDF, 105KB) PDF opens in a new windowBased on your answers, here’s how to set up a standing order:Complete the form belowYou can return the completed form to us by either:emailing it to - Commercialclientservicing@Lloydsbanking.com, orposting it to - Lloyds Bank, Commercial Servicing, Edinburgh, BX2 1LBSet up a standing order form (PDF, 106KB)PDF opens in a new windowStill need help?                                 expandable sectionTo get you to the right place, we just need to check a few details with you.Other ways to get in touchWas this helpful? YesNoNohttps://www.lloydsbank.com/business/help-and-support/payments/setting-up-a-standing-order.htmlSet up a standing orderFind out how to set a standing order from your business accounts.Standing orders are a way of making fixed payments to a person or business at regular intervals, you control the amount, as well as when and how often it’s paid.I’m registered for Online for BusinessLog onto Online for Business.Select Payments and transfers next to the account the standing order will be paid from.Choose who to pay, then enter the amount and reference.Tick the ‘Repeat Payment (make this a standing order)’ box.You’ll now see some additional fields. Select when payment should start, how often it should be made and how long it should continue.You’ll be able to view, change or delete your standing orders at any time in Online for Business.I’m not registered for Online for BusinessTo get you to the right form we just need a bit of information from you.Is your turnover over £25 million?                            No                                                    Yes                        Based on your answers, here’s how to set up a standing order:Complete the form belowYou can return the completed form to us by posting it to:Lloyds Bank, Box 1, BX1 1LTSet up a standing order form (PDF, 105KB) PDF opens in a new windowBased on your answers, here’s how to set up a standing order:Complete the form belowYou can return the completed form to us by either:emailing it to - Commercialclientservicing@Lloydsbanking.com, orposting it to - Lloyds Bank, Commercial Servicing, Edinburgh, BX2 1LBSet up a standing order form (PDF, 106KB)PDF opens in a new windowStill need help?                                 expandable sectionTo get you to the right place, we just need to check a few details with you.Other ways to get in touchWas this helpful? YesNoNo",https://www.lloydsbank.com/business/help-and-support/payments/setting-up-a-standing-order.html?WT.ac=lloyds-bb-help_support-category-regpymts-text-Set_up_standing_order
forgotten-o4b-logon-details.txt,"Forgotten your logon details?Find out how to reset your details using Online for Business or our app  Online for BusinessGo to the Online for Business page.Select the Forgotten your logon details? linkFollow the onscreen stepsMake sure you have your card and reader with you.Business Banking Mobile appLog on to our app using Face ID or your Fingerprint.Select the Profile icon, then Settings and then Reset your password.Follow the onscreen stepsStill need help?                                 expandable sectionBy Phone If you’re still having problems logging on, please call the Internet Banking helpdesk on 0345 300 0116.Lines are open 7am - 10pm Mon to Fri and 8am - 6pm Sat and Sun.Was this helpful? YesNoBusiness Banking Mobile appLog on to our app using Face ID or your Fingerprint.Select the Profile icon, then Settings and then Reset your password.Follow the onscreen stepsNo",https://www.lloydsbank.com/business/help-and-support/online-banking/forgotten-o4b-logon-details.html?WT.ac=lloyds-bb-help_support-category-onlbnkg-text-forgotten-O4B-logon-details
register-for-commercial-banking-online.txt,"Register for Commercial Banking OnlineCommercial Banking Online:helps you manage your business online.gives you access to both your sterling and currency accounts.lets you set access to accounts and functions. lets you tailor the service to suit your business needs.To get started, please contact your Relationship Manager.Find out more about Commerical Banking Online.Was this helpful? YesNoNo",https://www.lloydsbank.com/business/help-and-support/online-banking/register-for-commercial-banking-online.html?WT.ac=lloyds-bb-help_support-category-Gttngstrd-text-Register_for_Commercial_Banking_Online
security-and-fraud.txt,Security & fraudLost or stolen cardsReport a lost or stolen Business CardReport a lost or stolen Business payment cardReport a lost or stolen Corporate CardReport a lost or stolen Corpoarate cardReport a fraudReport a fraud on our business accountsMake a complaintReport fraudulent use of online bankingStaying safeProtect your business from fraudManage the cyber threat to your business,https://www.lloydsbank.com/business/help-and-support/security-and-fraud.html
contact-online-banking-helpdesks.txt,Contact the business online banking helpdesksFind the right number for help with our business online services.This page is for business customersFind out how to get in touch if you’re a personal customer.Contact us,https://www.lloydsbank.com/business/help-and-support/online-banking/contact-online-banking-helpdesks.html?WT.ac=lloyds-bb-help_support-category-gotprob-text-Contact_O4B_helpdesk
text-alerts.txt,"Text alertsOur free text alerts deliver account updates direct to your mobile phone, so you can keep track of your finances on the go. You can:Get account balances and transaction information sent to your mobile.Sign up for daily or weekly alerts.Receive alerts free of charge*.Features and benefits of text alertsGet daily updates, from Monday to Friday. Or weekly account updates on a day that you choose. Texts are sent between 7am and 10am.View your balance and up to six of your latest transactions in each text message.Choose which business accounts you receive text alerts for.Nominate another user to receive your texts.Register for text alertsChat in the mobile appIn the business banking app, go to Support then Message us.​Ask the assistant to ‘Register for text alerts’.Download the appBy phoneCall us on 0345 072 5555.Or +44 203 073 0006 if calling from abroad.We’re open 7am to 8pm Monday to Friday and 9am to 2pm on Saturdays.If you have a hearing or speech impairment, you can use Relay UK. You'll find more information at relayuk.bt.com.*If you receive text alerts while overseas you’re responsible for ensuring it’s lawful to receive text alerts in the country you are in.  Mobile providers may charge. To avoid this charge, you can pause text alerts at any time.  This means you won't receive alerts while you're away. Was this helpful?YesNoNo",https://www.lloydsbank.com/business/help-and-support/account-management/text-alerts.html?WT.ac=Lloyds-help_and_support-text_alerts-button_text-text_alerts
cancel-direct-debit.txt,"Cancel a Direct DebitFind out how to cancel a Direct Debit.OnlineI’m registered for Online for BusinessTo cancel a Direct Debit:Log onto Online for Business.Select More Actions next to the account the Direct Debit is paid from.Choose Direct Debits and standing orders, then Manage Direct Debits.Find the Direct Debit you want to cancel.You should also tell the company you're paying that you are cancelling the Direct Debit. I’m registered for Commercial Banking OnlineYou can view and cancel Direct Debits if you have a role with the right permissions. Your administrator can assign a Direct Debit role for you.To cancel a Direct Debit:Log on to Commercial Banking Online.Go to Manage payments and select Direct Debits.Enter the details for the account and select Search.Select the Direct Debit you want to cancel.Click Cancel Direct Debit.Follow the steps on screen to complete a security check You'll find step-by-step help in the Help Centre. To get there, select the question mark at the top of any page in Commercial Banking Online.Frequently asked questionsCan I cancel a Direct Debit in the app?                                 expandable sectionYes, depending on your level of access, you can cancel Direct Debits set up on your accounts.On the account details screen, find the account the Direct Debit is paid from and select ‘More’ and ‘Direct Debits’. Then open the Direct Debit you want to cancel and select ‘Delete’. Once it’s cancelled, you can only set it up again by contacting the company you’re paying and completing a new Direct Debit instruction.It’s possible the next payment will still be made even after you’ve cancelled it. This depends on when the next payment is due to be processed. You’ll see a message to let you know if this applies.Still need help?                                 expandable sectionTo get you to the right place, we just need to check a few details with you.Other ways to get in touchWas this helpful? YesNoNohttps://www.lloydsbank.com/business/help-and-support/payments/cancel-direct-debit.htmlCancel a Direct DebitFind out how to cancel a Direct Debit.OnlineI’m registered for Online for BusinessTo cancel a Direct Debit:Log onto Online for Business.Select More Actions next to the account the Direct Debit is paid from.Choose Direct Debits and standing orders, then Manage Direct Debits.Find the Direct Debit you want to cancel.You should also tell the company you're paying that you are cancelling the Direct Debit. I’m registered for Commercial Banking OnlineYou can view and cancel Direct Debits if you have a role with the right permissions. Your administrator can assign a Direct Debit role for you.To cancel a Direct Debit:Log on to Commercial Banking Online.Go to Manage payments and select Direct Debits.Enter the details for the account and select Search.Select the Direct Debit you want to cancel.Click Cancel Direct Debit.Follow the steps on screen to complete a security check You'll find step-by-step help in the Help Centre. To get there, select the question mark at the top of any page in Commercial Banking Online.Frequently asked questionsCan I cancel a Direct Debit in the app?                                 expandable sectionYes, depending on your level of access, you can cancel Direct Debits set up on your accounts.On the account details screen, find the account the Direct Debit is paid from and select ‘More’ and ‘Direct Debits’. Then open the Direct Debit you want to cancel and select ‘Delete’. Once it’s cancelled, you can only set it up again by contacting the company you’re paying and completing a new Direct Debit instruction.It’s possible the next payment will still be made even after you’ve cancelled it. This depends on when the next payment is due to be processed. You’ll see a message to let you know if this applies.Still need help?                                 expandable sectionTo get you to the right place, we just need to check a few details with you.Other ways to get in touchWas this helpful? YesNoNo",https://www.lloydsbank.com/business/help-and-support/payments/cancel-direct-debit.html?WT.ac=lloyds-bb-help_support-category-regpymts-text-cancel_direct_debit
update-phone-number.txt,"Update your phone numberIt's important that we have your correct phone number, in case we need to get in touch.  Or to check it's you when making online purchases and payments.Need to change your business address and phone number?  Fill out the form on this page.By postTo make sure we have the right phone number for you simply fill in, print, and send us this form.Update your phone numberBy phone                                 expandable sectionBy phoneYou can only change your number by phone if you have a PhoneBank for Business password. If you don’t have one, please complete the form in the By post option.Call us on 0345 072 5555.We’re open 7am to 8pm Monday to Friday and 9am to 2pm on Saturdays.Was this helpful? YesNoNo",https://www.lloydsbank.com/business/help-and-support/account-management/update-phone-number.html?WT.ac=lloyds-help_support-amendphone-category-accmgmt-FOM-amend_phone_number
make-a-complaint.txt,"Make a complaintWe’re committed to providing products and services of the very highest quality. If we haven't lived up to your expectations in any way, we'd like to know so we can put things right for you.Find out how to make a complaintMy business turnover is under £25mFind out how to make a complaint My business turnover is over £25mFind out how to make a complaint I want to make a complaint about CardnetRaising a complaint to CardnetInappropriate behaviour.We don't stand for inappropriate behaviour at Lloyds Bank. This applies equally to colleagues, customers, clients and suppliers. It includes:actions.things that are said.things that are written down.Any behaviour that has a negative impact on you is inappropriate. It doesn't have to be intentional, overt or abusive.If you witness such behaviour from one of our colleagues, please report it. You can do this by raising a complaint.We're also asking our colleagues to report any inappropriate behaviour they witness while doing their jobs.Find out more about our inclusion and diversity policies.Was this helpful? YesNoNo",https://www.lloydsbank.com/business/help-and-support/account-management/make-a-complaint.html?WT.ac=lloyds-bb-help_support-category-getintouch-text-Make_a_complaint
make-an-international-payment.txt,"Make an international paymentYou can make international payments in Online for Business and Commercial Banking Online.Online for BusinessTo find out how to make an international payment in Online for Business, follow these steps:Log on to Online for Business.Select ‘More actions’ next to the account you want to send money from.Under ‘Payments and transfers’, select ‘Make an international payment’.You can select an existing recipient from the drop-down box or pay someone new by entering the BIC/Swift code in the ‘I know the BIC/Swift code field’.If you’re setting up a new recipient on the next screen, you will be  asked to enter the country, IBAN or account number, recipient’s bank name and bank address, recipient’s name and their address. Select ‘continue’.Enter in the amount you want to pay, along with the currency you want to send it in.Review your payment then press ‘Confirm’.Commercial Banking OnlineYou can make International Payments in Commercial Banking Online.You’ll find step-by-step help in the Help Centre. To get here, select ‘Help’ at the top of any page or ‘Need any help?’ next to the page title in Commercial Banking Online.Frequently Asked QuestionsHow do I find my IBAN or BIC/Swift code?                                 expandable sectionWe have a dedicated Help & Support page for this.Find your IBAN or BIC.How much does it cost?                                 expandable sectionOnline for Business You can use our calculator when you're making an international payment. This will give you an idea of the rates and charges you may incur or you can take a look at our Rates and Charges.Commercial Banking OnlineContact your relationship team for information about fees for international payments.How do I cancel an international payment?                                 expandable sectionTo cancel a payment you’ve already made you’ll need to call our International Helpdesk on 0345 074 8888.We can’t guarantee we’ll be able to cancel the transaction once the money has left your account.Why has my payment been rejected?                                 expandable sectionYour payment may have been rejected because some information is missing or was entered incorrectly.For a payment to be successful you need:BIC/Swift codeIBAN numberRecipient’s bank name and bank addressRecipient’s name and addressIf you need more help finding out why your payment has been rejected, call our International Helpdesk on 0345 078 8888.What is a BIC or IBAN number?                                 expandable sectionBIC and IBAN numbers are only used in international payments.A Bank Identifier Code (BIC) – sometimes referred to as a Swift code, – is a number that helps identify the recipient’s bank.An International Bank Account Number (IBAN) is a number that helps identify the account you’re are paying money to.Still need help?                                 expandable sectionCall usIf you still need help, please call the Internet Banking Helpdesk on 0345 300 0116.We’re open Monday to Friday 7am – 10pm, Saturday and Sunday 8am – 6pm.Was this helpful?YesNoNo",https://www.lloydsbank.com/business/help-and-support/payments/make-an-international-payment.html?WT.ac=Lloyds-help_and_support-payments-button_text-make_an_international_payment
close-an-account.txt,Close an accountYou can ask for us to close an account by completing the Account Closure form. You can credit any closing balance to a new or existing bank account.Close an account formTo get you to the right form we just need a bit of information from you. Do you have a named Relationship Manager?                            No                                                    Yes                        Is your turnover over £25 million?                            No                                                    Yes                        Do you have outstanding lending facilities serviced by an account you would like to close?                            No                                                    Yes                        What do you mean by outstanding lending facilities?https://www.lloydsbank.com/business/help-and-support/account-management/close-an-account.htmlClose an accountYou can ask for us to close an account by completing the Account Closure form. You can credit any closing balance to a new or existing bank account.Close an account formTo get you to the right form we just need a bit of information from you. Do you have a named Relationship Manager?                            No                                                    Yes                        Is your turnover over £25 million?                            No                                                    Yes                        Do you have outstanding lending facilities serviced by an account you would like to close?                            No                                                    Yes                        What do you mean by outstanding lending facilities?,https://www.lloydsbank.com/business/help-and-support/account-management/close-an-account.html?WT.ac=lloyds-bb-help_support-category-acctdetails-text-Close_an_account
account-locked.txt,"Forgotten your Commercial Banking Online log in details?Find out how to get back online if you’ve forgotten your Commercial Banking Online log in details.I’ve forgotten my usernameClick 'Forgotten your username?' below the 'Continue' button on the login screen.Enter your registered email address, first and last names, and the last five digits of your security card. Click ‘Continue’.Complete the onscreen questions and your username will be displayed.I’ve forgotten my passwordIf you've entered the wrong log in details too many times, you'll be locked out of your account.  You can unlock your user account yourself by resetting your password. You'll need your username, registered email address, security card and card reader.Click 'Forgotten your password?’ below the 'Continue' button on the login screen. Enter your username, registered email address,  and the last five digits of your security card. Click 'Confirm’.Next we'll do a quick security check. You'll need your security card and card reader. Follow the steps on screen.Enter and confirm a new password. Your new password must:be 8-32 characters longinclude at least 2 uppercase letters (A-Z)include at least 3 lowercase letters (a-z)include at least 1 digit (0-9)not include character spaces or these special characters ( # < = > [ / ] ^ ` { | } ~ )be different from your last 12 passwordsnot include your name or any of your login details.Click 'Confirm'. You will now be able to log in with your new password.Still need help?                                Still need help? expandable sectionBy phoneCall us on 0808 202 1390.Lines are open 8am to 6pm Monday to Friday.Please have your Telephony PIN with you when you call so we can identity you.Was this helpful? YesNoNo",https://www.lloydsbank.com/business/help-and-support/online-banking/account-locked.html?WT.ac=Lloyds-help_and_support-online_banking-button_text-ive_forgotten_my_commercial_banking_online_log_in_details
